courseId,courseTitle,subTitle,courseLink,courseProvider,unitSold,soldOrEnq,offerPrice,originalPrice,haveCpd,cpdAccreditedBy,haveProfQual,isRegulated
238590,Dog Training Essentials (Basic Dog Trainer Course) - CPD Certified,Accredited Online Course | Recognised Certificate Included | Unlimited 24/7 Lifetime Access,https://www.reed.co.uk/courses/dog-training-essentials-basic-dog-trainer-course-cpd-certified/238590#/courses/discount?pageno=3&sortby=MostPopular,International Open Academy,92,92 students purchased this course,12.0,99.0,yes,The CPD Certification Service,no,no
76433,Interior Design and Home Styling - CPD Certified,Certificate Included | Lifetime Access | Recognized Certificate| 50 CPD Points |Discount Courses,https://www.reed.co.uk/courses/interior-design-and-home-styling-cpd-certified/76433#/courses/discount?pageno=3&sortby=MostPopular,Trendimi,308,308 students purchased this course,10.0,119.0,yes,The CPD Certification Service,no,no
241323,Airport Management Course - CPD Accredited,Exam Included . CPD Accredited Qualification . Lifetime access . Immediate Result,https://www.reed.co.uk/courses/airport-management-course-cpd-accredited/241323#/courses/discount?pageno=3&sortby=MostPopular,Course Gate,146,146 students purchased this course,13.0,175.0,yes,CPD Accreditation Group,no,no
244089,Master Herbalist Certificate (Alternative Medicine) - CPD Certified,Accredited Online Course | Recognised Certificate Included | Unlimited 24/7 Lifetime Access |Special Deal,https://www.reed.co.uk/courses/master-herbalist-certificate-alternative-medicine-cpd-certified/244089#/courses/discount?pageno=3&sortby=MostPopular,International Open Academy,121,121 students purchased this course,10.0,99.0,yes,The CPD Certification Service,no,no
244651,Mental Health and Young People Course and Certificate* ,"Course, PDF Certificate, Tutor Support and Final Exam all included ",https://www.reed.co.uk/courses/mental-health-and-young-people-course-and-certificate/244651#/courses/discount?pageno=3&sortby=MostPopular,eTeaching Academy,120,120 students purchased this course,24.0,199.99,yes,The CPD Certification Service,no,no
245034,Mental Health Care Training - MCA & DOLS,Level 3 Endorsed Diploma by TQUK | 10 CPD Points I MCQ Based Assessment | Full Tutor Support | Instant Result,https://www.reed.co.uk/courses/mental-health-care-training-mca-dols/245034#/courses/discount?pageno=3&sortby=MostPopular,One Education,168,168 students purchased this course,18.0,199.0,yes,Training Qualifications UK Ltd,yes,no
245728,International Massage Course - CPD Accredited,International Massage Course Accredited by CPD  | Full Tutor Support | Instant Result | No hidden fees,https://www.reed.co.uk/courses/international-massage-course-cpd-accredited/245728#/courses/discount?pageno=3&sortby=MostPopular,One Education,214,214 students purchased this course,10.0,199.0,yes,CPD Accreditation Group,no,no
196424,Safeguarding Children Level 3 – Online Training Course – NHS Health & Care - UK Accredited,Instant Access | Includes Assessment & Certificate | UK CPD Accredited | Instant Certificate Download,https://www.reed.co.uk/courses/safeguarding-children-level-3--online-training-course--nhs-health-care-uk-accredited/196424#/courses/discount?pageno=3&sortby=MostPopular,Mandatory Compliance,281,281 students purchased this course,15.0,24.99,yes,The CPD Certification Service,no,no
266428,Certificate in Electrical Wiring – Level 3,Recognised Accredited Qualification| Endorsed Certificate | Certified Unit Summery,https://www.reed.co.uk/courses/certificate-in-electrical-wiring--level-3/266428#/courses/discount?pageno=3&sortby=MostPopular,Study365,86,86 students purchased this course,12.0,79.0,no,ABC Awards,yes,no
227507,Child Psychology Course,Child Psychology level 1 Award Certificate endorsed by ABC Awards with study materials tutor support ,https://www.reed.co.uk/courses/child-psychology-course/227507#/courses/discount?pageno=3&sortby=MostPopular,CPD Courses,104,104 students purchased this course,10.0,140.0,no,ABC Awards,yes,no
247081,Facilities Management Diploma,Facilities Management Diploma Level 6 endorsed by ABC Awards |Tutor Support and Assessments included in the Course Price,https://www.reed.co.uk/courses/facilities-management-diploma/247081#/courses/discount?pageno=3&sortby=MostPopular,Brentwood Open learning College,638,638 students purchased this course,10.0,860.0,no,ABC Awards,yes,no
236909,Bookkeeping - Book keeping Course,Online Bookkeeping Level 1 Basic course endorsed by ABC Awards | Tutor Support and Assessments included in Course Price,https://www.reed.co.uk/courses/bookkeeping-book-keeping-course/236909#/courses/discount?pageno=3&sortby=MostPopular,Brentwood Open learning College,312,312 students purchased this course,10.0,180.0,no,ABC Awards,yes,no
238233,"Microsoft Excel Complete Course 2019 - Beginner, Intermediate & Advanced - CPD Accredited",Updated with MS Excel 2019 New Features . Exam Included . Accredited Qualification . Lifetime access . Instant Result,https://www.reed.co.uk/courses/microsoft-excel-complete-course-2019-beginner-intermediate-advanced-cpd-accredited/238233#/courses/discount?pageno=3&sortby=MostPopular,Course Gate,457,457 students purchased this course,19.0,175.0,yes,CPD Accreditation Group,no,no
76401,The Ultimate Microsoft Office Online Bundle ,"Expert training in Excel, Advanced Excel, PivotTables, Word, Outlook, PowerPoint & SharePoint",https://www.reed.co.uk/courses/the-ultimate-microsoft-office-online-bundle/76401#/courses/discount?pageno=3&sortby=MostPopular,Excel with Business,964,964 students purchased this course,59.0,413.0,yes,The CPD Certification Service,no,no
81253,Health and Safety Level 2,"ROSPA Accredited, Institute of Hospitality Endorsed, CPD and Local Authority Approved",https://www.reed.co.uk/courses/health-and-safety-level-2/81253#/courses/discount?pageno=3&sortby=MostPopular,The Training Terminal,434,434 students purchased this course,12.0,30.0,yes,The CPD Standards Office,no,no
98736,Microsoft Excel – Beginner Course - CPD Accredited,Student Discount Card Eligible | Lifetime Access | Online certified training |Online certificate and exam included,https://www.reed.co.uk/courses/microsoft-excel--beginner-course-cpd-accredited/98736#/courses/discount?pageno=3&sortby=MostPopular,Be-a.co.uk,2283,"2,283 students purchased this course",12.0,199.0,yes,The CPD Certification Service,no,no
192785,Medications Management Level 2 – Online Training Course – CPD Certified,Instant Access | Includes Assessment & Certificate | UK CPD Accredited | Instant Certificate Download,https://www.reed.co.uk/courses/medications-management-level-2--online-training-course--cpd-certified/192785#/courses/discount?pageno=3&sortby=MostPopular,Imperium Edge,159,159 students purchased this course,16.49,19.99,yes,The CPD Certification Service,no,no
266901,Sports Coaching Diploma - CPD Accredited,CPD Accredited Diploma in Sports Coaching Course | Full Tutor Support | Instant Result | No hidden fees,https://www.reed.co.uk/courses/sports-coaching-diploma-cpd-accredited/266901#/courses/discount?pageno=3&sortby=MostPopular,One Education,56,56 students purchased this course,17.0,199.0,yes,CPD Accreditation Group,no,no
55369,"Adobe Photoshop, Illustrator & InDesign Master Online Training Bundle",24x7 Online Unlimited Access For 12 Months,https://www.reed.co.uk/courses/adobe-photoshop-illustrator-indesign-master-online-training-bundle/55369#/courses/discount?pageno=3&sortby=MostPopular,Learning 247,276,276 students purchased this course,57.0,240.0,no,Adobe,yes,no
239015,Funeral Service Business Course - CPD Accredited,CPD endorsed Certification,https://www.reed.co.uk/courses/funeral-service-business-course-cpd-accredited/239015#/courses/discount?pageno=3&sortby=MostPopular,One Education,171,171 students purchased this course,16.0,199.0,yes,CPD Accreditation Group,no,no
76531,Holistic Therapist Accredited Course - CPD Certified,Certificate Included | Fast Track to a New Career | Lifetime Access |Discount courses,https://www.reed.co.uk/courses/holistic-therapist-accredited-course-cpd-certified/76531#/courses/discount?pageno=3&sortby=MostPopular,Trendimi,216,216 students purchased this course,12.0,99.0,yes,The CPD Certification Service,no,no
241353,Sports First Aid - CPD Accredited,Exam Included . CPD Accredited Qualification . Lifetime access . Immediate Result,https://www.reed.co.uk/courses/sports-first-aid-cpd-accredited/241353#/courses/discount?pageno=3&sortby=MostPopular,Course Gate,258,258 students purchased this course,13.0,175.0,yes,CPD Accreditation Group,no,no
241844,Youth Work Certificate Level 2,Exam Included . CPD Accredited Qualification . Lifetime access . Immediate Result,https://www.reed.co.uk/courses/youth-work-certificate-level-2/241844#/courses/discount?pageno=3&sortby=MostPopular,Course Gate,292,292 students purchased this course,15.0,175.0,yes,CPD Accreditation Group,no,no
246581,Canine Behaviour and Psychology Level 3 - CPD Accredited,Canine Behaviour and Psychology Level 3 Course Accredited by CPD  | Full Tutor Support | Instant Result | No hidden fees,https://www.reed.co.uk/courses/canine-behaviour-and-psychology-level-3-cpd-accredited/246581#/courses/discount?pageno=3&sortby=MostPopular,One Education,88,88 students purchased this course,13.0,199.0,yes,CPD Accreditation Group,no,no
246682,Primary Teacher Training - CPD Accredited,Primary Teacher Training Course Accredited by CPD | Full Tutor Support | Instant Result | No hidden fees,https://www.reed.co.uk/courses/primary-teacher-training-cpd-accredited/246682#/courses/discount?pageno=3&sortby=MostPopular,One Education,148,148 students purchased this course,15.0,199.0,yes,CPD Accreditation Group,no,no
246715,Health and Safety Level 3 Certificate- RoSPA Accredited Course,Fully accredited through RoSPA and CPD with tutor support and final exam included,https://www.reed.co.uk/courses/health-and-safety-level-3-certificate-rospa-accredited-course/246715#/courses/discount?pageno=3&sortby=MostPopular,Intellelearn,217,217 students purchased this course,55.0,225.0,yes,Royal Society for the Prevention of Accidents,yes,no
250445,Mental Health and Psychiatry Training,"Enrol today and receive your online training, tutor support, PDF certificate and more ",https://www.reed.co.uk/courses/mental-health-and-psychiatry-training/250445#/courses/discount?pageno=3&sortby=MostPopular,Oplex Careers,87,87 students purchased this course,24.0,249.99,yes,The CPD Certification Service,no,no
209994,EYFS Teaching Diploma - CPD Certified,Student Discount Card Eligible | Lifetime Access | Online certified training |Online certificate and exam included,https://www.reed.co.uk/courses/eyfs-teaching-diploma-cpd-certified/209994#/courses/discount?pageno=3&sortby=MostPopular,Be-a.co.uk,525,525 students purchased this course,19.0,299.0,yes,The CPD Certification Service,no,no
211150,Hotel Management Course,Hotel Management (Level 7) Diploma | Endorsed by ABC Awards | CPD Accredited Certificate | 190 CPD Points/Credits,https://www.reed.co.uk/courses/hotel-management-course/211150#/courses/discount?pageno=3&sortby=MostPopular,CPD Courses,67,67 students purchased this course,29.0,1100.0,yes,ABC Awards,yes,no
264270,Interior Design For Beginners,Interior Design Certificate For Beginners Endorsed by ABC Awards I Exam Included I MCQ based assessment I Tutor Support,https://www.reed.co.uk/courses/interior-design-for-beginners/264270#/courses/discount?pageno=3&sortby=MostPopular,Course Gate,93,93 students purchased this course,10.99,300.0,no,ABC Awards,yes,no
264325,Manual Handling Training,Certificate included I CPD Certified I RoSPA approved I Audio visual training,https://www.reed.co.uk/courses/manual-handling-training/264325#/courses/discount?pageno=3&sortby=MostPopular,Training Express Ltd,42,42 students purchased this course,10.0,45.0,yes,The CPD Certification Service,no,no
220996,Level 2 Certificate in Gardening and Landscaping,E-certificate and exam included| Online certified training | CPD & IAP Accredited | Unlimited 365 Days Access,https://www.reed.co.uk/courses/level-2-certificate-in-gardening-and-landscaping/220996#/courses/discount?pageno=3&sortby=MostPopular,Infinity Learning,139,139 students purchased this course,12.0,249.0,yes,The CPD Certification Service,no,no
267043,Building Surveying - CPD Accredited,Exam Included . CPD Accredited Qualification . Lifetime access . Immediate Result,https://www.reed.co.uk/courses/building-surveying-cpd-accredited/267043#/courses/discount?pageno=3&sortby=MostPopular,Course Gate,56,56 students purchased this course,14.0,175.0,yes,CPD Accreditation Group,no,no
269748,ECDL,NEW 2020 ECDL,https://www.reed.co.uk/courses/ecdl/269748#/courses/discount?pageno=3&sortby=MostPopular,e-courses4you,17,17 students purchased this course,10.0,399.99,no,"BCS, The Chartered Institute for IT",yes,no
216953,Beauty Therapy - Course,Beauty Therapy Level 3 Certificate endorsed by ABC Awards with study materials and tutor support. ,https://www.reed.co.uk/courses/beauty-therapy-course/216953#/courses/discount?pageno=3&sortby=MostPopular,Oxford Home Study College,204,204 students purchased this course,10.0,380.0,no,ABC Awards,yes,no
74831,Microsoft Excel Course (CPD Accredited),Tailored Excel learning for Beginner - Intermediate level. Perfect for Individual and Business Excel use,https://www.reed.co.uk/courses/microsoft-excel-course-cpd-accredited/74831#/courses/discount?pageno=3&sortby=MostPopular,Excel with Business,1312,"1,312 students purchased this course",15.0,59.0,yes,The CPD Certification Service,no,no
246733,Minute Taking Training,"Enrol today and receive your online training, tutor support, PDF certificate and more ",https://www.reed.co.uk/courses/minute-taking-training/246733#/courses/discount?pageno=3&sortby=MostPopular,Oplex Careers,166,166 students purchased this course,14.0,199.99,yes,The CPD Certification Service,no,no
196486,PRINCE2® Foundation and Practitioner 6th Edition e-learning with both Accredited Exams,Educating Professionals ,https://www.reed.co.uk/courses/prince2-foundation-and-practitioner-6th-edition-e-learning-with-both-accredited-exams/196486#/courses/discount?pageno=3&sortby=MostPopular,Balance Global,1151,"1,151 students enquired about this course",569.0,829.0,no,PEOPLECERT),yes,no
197535,Travel & Tourism ,Travel & Tourism (Level 7) Endorsed by ABC Awards | CPD Accredited Certificate | 190 CPD Points/Credits,https://www.reed.co.uk/courses/travel-tourism/197535#/courses/discount?pageno=3&sortby=MostPopular,CPD Courses,353,353 students purchased this course,29.0,1050.0,yes,ABC Awards,yes,no
255171,Copywriting Course Level 4,ABC Awards Endorsed Professional Certificate . Level 4 . MCQ Assessment . Lifetime access,https://www.reed.co.uk/courses/copywriting-course-level-4/255171#/courses/discount?pageno=3&sortby=MostPopular,Course Gate,201,201 students purchased this course,13.99,300.0,no,ABC Awards,yes,no
218892,Speech and Language Therapy Course - Accredited Certification,Summary,https://www.reed.co.uk/courses/speech-and-language-therapy-course-accredited-certification/218892#/courses/discount?pageno=3&sortby=MostPopular,eTeaching Academy,487,487 students purchased this course,19.0,199.99,yes,The CPD Certification Service,no,no
266493,Administration,Level 5 Diploma in Administration (CPD Accredited) with tutor support and quiz based exam included,https://www.reed.co.uk/courses/administration/266493#/courses/discount?pageno=3&sortby=MostPopular,UK Professional Development Academy LTD,67,67 students purchased this course,10.0,650.0,yes,Step Ahead CPD Qualifications,no,no
267048,Compliance Management - CPD Accredited,Free PDF Certificate | CPD Accredited  Compliance Management | Full Tutor Support | Instant Result | No hidden fees,https://www.reed.co.uk/courses/compliance-management-cpd-accredited/267048#/courses/discount?pageno=3&sortby=MostPopular,One Education,40,40 students purchased this course,15.0,199.0,yes,CPD Accreditation Group,no,no
229661,Professional Chef Diploma Level 3 and Hospitality Management Level 2 - CPD Certified,CPD Approved Training II Instant Access II Flexible Study II Free e-certificate included,https://www.reed.co.uk/courses/professional-chef-diploma-level-3-and-hospitality-management-level-2-cpd-certified/229661#/courses/discount?pageno=3&sortby=MostPopular,Janets,173,173 students purchased this course,21.0,249.0,yes,CPD Accreditation Group,no,no
229786,Teaching Assistant CACHE Level 2 **FULL QUALIFICATION**,Train to teach - Get Qualified - NCFE & CACHE Level 2 - Accepted by Ofstead,https://www.reed.co.uk/courses/teaching-assistant-cache-level-2-full-qualification/229786#/courses/discount?pageno=3&sortby=MostPopular,Careers Advice & Learning  Centre,0,413 students enquired about this course,195.0,375.0,no,Ofqual,yes,yes
230768,Event Management,Event Management Level 7 Diploma | Endorsed by ABC Awards | CPD Accredited Certificate | 180 CPD Points,https://www.reed.co.uk/courses/event-management/230768#/courses/discount?pageno=3&sortby=MostPopular,CPD Courses,129,129 students purchased this course,29.0,1050.0,yes,ABC Awards,yes,no
245448,IT Security Diploma (Level 3),Level 3 Diploma in Cyber Security l 40 CPD Credits / Points l CPD Accredited Diploma|Tutor support and Quiz based,https://www.reed.co.uk/courses/it-security-diploma-level-3/245448#/courses/discount?pageno=3&sortby=MostPopular,UK Professional Development Academy LTD,109,109 students purchased this course,10.0,495.0,yes,The CPD Accreditation Group,no,no
192104,Estate Agency Training Course - Awarded Certificate,Summary,https://www.reed.co.uk/courses/estate-agency-training-course-awarded-certificate/192104#/courses/discount?pageno=3&sortby=MostPopular,Oplex Careers,693,693 students purchased this course,19.0,249.99,yes,The CPD Certification Service,no,no
196138,UK Employment Law Diploma - CPD Certified,Student Discount Card Eligible | Lifetime Access | Online certified training |Online certificate and exam included,https://www.reed.co.uk/courses/uk-employment-law-diploma-cpd-certified/196138#/courses/discount?pageno=3&sortby=MostPopular,Be-a.co.uk,1031,"1,031 students purchased this course",16.0,299.0,yes,The CPD Certification Service,no,no
255412,UK Tax Accounting Course,CPD accredited online course - Exam and Certificate included,https://www.reed.co.uk/courses/uk-tax-accounting-course/255412#/courses/discount?pageno=3&sortby=MostPopular,Harley Oxford,98,98 students purchased this course,14.0,299.0,yes,The CPD Standards Office,no,no
201582,Facilities Management ,Facilities Management Advanced Level 5 Diploma. Endorsed by ABC Awards | 100 CPD Points | CPD Accredited Certificate,https://www.reed.co.uk/courses/facilities-management/201582#/courses/discount?pageno=3&sortby=MostPopular,CPD Courses,365,365 students purchased this course,10.0,750.0,yes,ABC Awards,yes,no
202931,Plumbing Training ,Exam and Free E - Certificate Included | CPD & IAP Accredited | Access for 365 days |,https://www.reed.co.uk/courses/plumbing-training/202931#/courses/discount?pageno=3&sortby=MostPopular,Global Edulink,115,115 students purchased this course,25.0,199.0,yes,The CPD Certification Service,no,no
262857,Housing Officer Training - CPD Accredited,Exam Is Included With The Course Price | Tutor Support | Instant Result | | No Hidden Fees | 12 Months Access,https://www.reed.co.uk/courses/housing-officer-training-cpd-accredited/262857#/courses/discount?pageno=3&sortby=MostPopular,One Education,88,88 students purchased this course,18.0,199.0,yes,CPD Accreditation Group,no,no
264277,Teaching Assistant Level 2,Professional Teaching Assistant Certificate Endorsed by ABC Awards I Exam Included I Tutor Support,https://www.reed.co.uk/courses/teaching-assistant-level-2/264277#/courses/discount?pageno=3&sortby=MostPopular,Course Gate,54,54 students purchased this course,10.99,300.0,no,ABC Awards,yes,no
228163,Level 2 Certificate in Cleaning - CPD Certified,CPD Approved Training II Instant Access II Flexible Study II Free e-certificate included,https://www.reed.co.uk/courses/level-2-certificate-in-cleaning-cpd-certified/228163#/courses/discount?pageno=3&sortby=MostPopular,Janets,175,175 students purchased this course,21.0,339.0,no,missing,no,no
269372,Interior Design,Level 5 Diploma Endorsed by ABC Awards I Exam Included I MCQ based assessment I Tutor Support,https://www.reed.co.uk/courses/interior-design/269372#/courses/discount?pageno=3&sortby=MostPopular,Course Gate,20,20 students purchased this course,10.0,300.0,no,ABC Awards,yes,no
269655,CCNA - Cisco Certified Network Associate (New 2020),200-301 (New 2020),https://www.reed.co.uk/courses/ccna-cisco-certified-network-associate-new-2020/269655#/courses/discount?pageno=3&sortby=MostPopular,e-courses4you,19,19 students purchased this course,10.0,599.99,no,Cisco Systems,yes,no
226754,Hospitality Management ,Hospitality Management Advanced Diploma Endorsed by ABC Awards ,https://www.reed.co.uk/courses/hospitality-management/226754#/courses/discount?pageno=3&sortby=MostPopular,Brentwood Open learning College,142,142 students purchased this course,14.0,760.0,no,ABC Awards,yes,no
97942,Teaching Assistant ,Teaching Assistant Level 5 Advanced Diploma Tutor Support and Assessments included in the Course Price.,https://www.reed.co.uk/courses/teaching-assistant/97942#/courses/discount?pageno=3&sortby=MostPopular,Oxford Home Study College,144,144 students purchased this course,10.0,740.0,no,ABC Awards,yes,no
78716,Gel Manicure and Nail Artist - CPD Accredited - (Professional Nail Technician Course) ,Fast Track to a New Career | Certificate Included | Lifetime Access | Discount Courses,https://www.reed.co.uk/courses/gel-manicure-and-nail-artist-cpd-accredited-professional-nail-technician-course/78716#/courses/discount?pageno=3&sortby=MostPopular,Trendimi,534,534 students purchased this course,10.0,119.0,yes,The CPD Certification Service,no,no
78726,Personal Assistant - (PA Training Course) - CPD Certified ,Accredited Online Course | Recognised Certificate Included | Unlimited 24/7 Lifetime Access | Special Offer,https://www.reed.co.uk/courses/personal-assistant-pa-training-course-cpd-certified/78726#/courses/discount?pageno=3&sortby=MostPopular,International Open Academy,373,373 students purchased this course,10.0,119.0,yes,The CPD Certification Service,no,no
80246,Massage Therapy - Level 3 CPD Accredited Course,Summary,https://www.reed.co.uk/courses/massage-therapy-level-3-cpd-accredited-course/80246#/courses/discount?pageno=3&sortby=MostPopular,Oplex Careers,745,745 students purchased this course,19.0,249.99,yes,The CPD Certification Service,no,no
96809,Bike Maintenance - CPD Certified ,Accredited Online Course | Recognised Certificate Included | Unlimited 24/7 Lifetime Access | Special Offer,https://www.reed.co.uk/courses/bike-maintenance-cpd-certified/96809#/courses/discount?pageno=3&sortby=MostPopular,International Open Academy,175,175 students purchased this course,10.0,119.0,yes,The CPD Certification Service,no,no
120288,Teaching Phonics Course  - CPD Accredited,Summary,https://www.reed.co.uk/courses/teaching-phonics-course-cpd-accredited/120288#/courses/discount?pageno=3&sortby=MostPopular,Study with Excellence,605,605 students purchased this course,19.0,299.99,yes,The CPD Certification Service,no,no
246720,COSHH- RoSPA and CPD accredited course,Online course with tutor support and instant downloadable certificate,https://www.reed.co.uk/courses/coshh-rospa-and-cpd-accredited-course/246720#/courses/discount?pageno=3&sortby=MostPopular,Intellelearn,104,104 students purchased this course,17.0,55.0,yes,Royal Society for the Prevention of Accidents,yes,no
192983,Dementia Awareness - Level 1 - Online Course - CPD Accredited,Instant Access | Includes Assessment & Certificate | UK CPD Accredited | Instant Certificate Download,https://www.reed.co.uk/courses/dementia-awareness-level-1-online-course-cpd-accredited/192983#/courses/discount?pageno=3&sortby=MostPopular,Mandatory Training Group,25,25 students purchased this course,12.75,14.99,yes,The CPD Certification Service,no,no
196642,Change Management® Foundation and Practitioner e-learning with both Accredited Exams,Educating Professionals ,https://www.reed.co.uk/courses/change-management-foundation-and-practitioner-e-learning-with-both-accredited-exams/196642#/courses/discount?pageno=3&sortby=MostPopular,Balance Global,317,317 students enquired about this course,553.0,1090.0,no,APM Group Limited,yes,no
254858,Business Data Analysis,"Level 5 Diploma in Business Data Analysis, CPD Accredited Diploma with tutor support and Quiz Based Exam Included",https://www.reed.co.uk/courses/business-data-analysis/254858#/courses/discount?pageno=3&sortby=MostPopular,UK Professional Development Academy LTD,76,76 students purchased this course,15.0,595.0,yes,Step Ahead CPD,no,no
266388,Certificate In Childcare & Nannying - Level 3,Recognised Accredited Qualification| Endorsed Certificate | Certified Unit Summery|,https://www.reed.co.uk/courses/certificate-in-childcare-nannying-level-3/266388#/courses/discount?pageno=3&sortby=MostPopular,Study365,23,23 students purchased this course,12.0,79.0,no,ABC Awards,yes,no
268086,Payroll,Certificate in Payroll Management - CPD Accredited with quiz based exam included,https://www.reed.co.uk/courses/payroll/268086#/courses/discount?pageno=3&sortby=MostPopular,UK Professional Development Academy LTD,27,27 students purchased this course,19.0,450.0,yes,Step Ahead CPD Qualifications,no,no
238066,Executive Mini MBA ,Exam Included in Price | CPD & IAP Accredited | Free Career Support Service | Unlimited 12 months access,https://www.reed.co.uk/courses/executive-mini-mba/238066#/courses/discount?pageno=3&sortby=MostPopular,1 Training,186,186 students purchased this course,12.0,399.0,yes,The CPD Certification Service,no,no
