courseId,courseTitle,subTitle,courseLink,courseProvider,unitSold,soldOrEnq,offerPrice,originalPrice,haveCpd,cpdAccreditedBy,haveProfQual,isRegulated
224161,Nursing Assistant Diploma ,Exam Included in Price | CPD & IAP Accredited | Free Career Support Service | Unlimited 12 months access,https://www.reed.co.uk/courses/nursing-assistant-diploma/224161#/courses/discount?pageno=2&sortby=MostPopular,1 Training,190,190 students purchased this course,12.0,399.0,yes,The CPD Certification Service,no,no
238940,Advanced Diploma in Health and Safety,Exam Included . CPD Accredited Qualification . Lifetime access . Immediate Result,https://www.reed.co.uk/courses/advanced-diploma-in-health-and-safety/238940#/courses/discount?pageno=2&sortby=MostPopular,Course Gate,622,622 students purchased this course,10.0,175.0,yes,CPD Accreditation Group,no,no
247388,Medicinal Cannabis & CBD Oil Diploma Course,Summary,https://www.reed.co.uk/courses/medicinal-cannabis-cbd-oil-diploma-course/247388#/courses/discount?pageno=2&sortby=MostPopular,Centre of Excellence,135,135 students purchased this course,49.0,147.0,yes,The CPD Certification Service,no,no
230747,Bookkeeping - Book keeping Course,Bookkeeping - Book keeping Level 3 | Endorsed by ABC Awards | CPD Accredited Certificate |30 CPD Points/Credits,https://www.reed.co.uk/courses/bookkeeping-book-keeping-course/230747#/courses/discount?pageno=2&sortby=MostPopular,CPD Courses,368,368 students purchased this course,10.0,395.0,yes,ABC Awards,yes,no
267070,Business Development ,Business Development Level 7 Diploma Endorsed by ABC Awards| Support&Assessments included in course price|Happy New Year,https://www.reed.co.uk/courses/business-development/267070#/courses/discount?pageno=2&sortby=MostPopular,Oxford Home Study College,76,76 students purchased this course,10.0,1050.0,no,ABC Awards,yes,no
57653,Copywriting course  (Level 4 Diploma) ,Unlimited personal tutor support | Fully accredited | Endorsed ABC Awards certificate| Help finding copywriting work ,https://www.reed.co.uk/courses/copywriting-course-level-4-diploma/57653#/courses/discount?pageno=2&sortby=MostPopular,College of Media and Publishing,838,838 students enquired about this course,296.7,494.5,yes,ABC Awards,yes,no
242647,Executive PA,Level 7 Diploma in Executive PA l Complete Ms Office Included l MCQs Exam I Endorsed By TQUK,https://www.reed.co.uk/courses/executive-pa/242647#/courses/discount?pageno=2&sortby=MostPopular,Inspire London College Ltd,123,123 students purchased this course,10.0,995.0,no,Training Qualifications UK Ltd,yes,no
245363,SEN Teaching Assistant Diploma - 5 CPD Accredited Courses,"Accredited SEN, Language, Autism, Dyslexia & ADHD Online Courses | Recognised Certificate Included | 24/7 Access ",https://www.reed.co.uk/courses/sen-teaching-assistant-diploma-5-cpd-accredited-courses/245363#/courses/discount?pageno=2&sortby=MostPopular,International Open Academy,96,96 students purchased this course,39.0,575.0,yes,The CPD Certification Service,no,no
248460,Level 6 Diploma in Facilities Management l TQUK Endorsed l MCQs Assessment ,Level 6 Diploma in Facilities Management II Endorsed Diploma by TQUK II Quiz Based Exam Included,https://www.reed.co.uk/courses/level-6-diploma-in-facilities-management-l-tquk-endorsed-l-mcqs-assessment/248460#/courses/discount?pageno=2&sortby=MostPopular,Inspire London College Ltd,133,133 students purchased this course,10.0,795.0,no,Training Qualifications UK Ltd,yes,no
259704,Motorcycle Mechanic Training - CPD Accredited,Exam & Tutor Support Included With The Course Price | Instant Result |  | No Hidden Fees | 12 Months Access,https://www.reed.co.uk/courses/motorcycle-mechanic-training-cpd-accredited/259704#/courses/discount?pageno=2&sortby=MostPopular,One Education,131,131 students purchased this course,14.0,199.0,yes,CPD Accreditation Group,no,no
218404,Dog Walking - CPD Certified,Accredited Online Course | Recognised Certificate Included | Unlimited 24/7 Lifetime Access |Special Offer,https://www.reed.co.uk/courses/dog-walking-cpd-certified/218404#/courses/discount?pageno=2&sortby=MostPopular,International Open Academy,141,141 students purchased this course,10.0,99.0,yes,The CPD Certification Service,no,no
197909,Customer Service Level 1,Customer Service Basics Endorsed by ABC Awards - Special Offer,https://www.reed.co.uk/courses/customer-service-level-1/197909#/courses/discount?pageno=2&sortby=MostPopular,CPD Courses,41,41 students purchased this course,10.0,180.0,no,ABC Awards,yes,no
131489,Office Admin and Receptionist Skills,Exam Included in Price | CPD & IAP Accredited | Free Career Support Service | Unlimited 12 months access,https://www.reed.co.uk/courses/office-admin-and-receptionist-skills/131489#/courses/discount?pageno=2&sortby=MostPopular,1 Training,488,488 students purchased this course,10.0,349.0,yes,The CPD Certification Service,no,no
250244,Level 3 Certificate in Assessing Vocational Achievement (CAVA) (RQF) – A1 Assessors Award,Awarded by TQUK I Ofqual Regulated I Free PDF Book I Step by Step Guideline I Full Tutor Support I 12 Months Access,https://www.reed.co.uk/courses/level-3-certificate-in-assessing-vocational-achievement-cava-rqf--a1-assessors-award/250244#/courses/discount?pageno=2&sortby=MostPopular,One Education,347,347 students purchased this course,23.0,599.0,no,Ofqual,yes,yes
199379,Accounting Course,Accounting Basics Level 1 course endorsed by ABC Awards | 30 CPD Points/Credits | CPD Accredited Certificate,https://www.reed.co.uk/courses/accounting-course/199379#/courses/discount?pageno=2&sortby=MostPopular,CPD Courses,418,418 students purchased this course,10.0,180.0,yes,ABC Awards,yes,no
255413,120HR TEFL: Teaching English As A Foreign Language Diploma,CPD accredited online course | Exam and Certificate included,https://www.reed.co.uk/courses/120hr-tefl-teaching-english-as-a-foreign-language-diploma/255413#/courses/discount?pageno=2&sortby=MostPopular,Harley Oxford,116,116 students purchased this course,19.0,300.0,yes,The CPD Certification Service,no,no
256780,Diploma in Health & Social Care - Level 3, Cost of exam(s) or assessments(s) not included in price & must be purchased separately,https://www.reed.co.uk/courses/diploma-in-health-social-care-level-3/256780#/courses/discount?pageno=2&sortby=MostPopular,Study365,106,106 students purchased this course,29.0,99.0,no,ABC Awards,yes,no
259793,Certified Anti Money Laundering Specialist (CAMS) - CPD Certified,CPD Approved Training II Instant Access II Flexible Study II Free e-certificate included,https://www.reed.co.uk/courses/certified-anti-money-laundering-specialist-cams-cpd-certified/259793#/courses/discount?pageno=2&sortby=MostPopular,Janets,121,121 students purchased this course,18.0,315.0,yes,The CPD Group,no,no
264320,Fire Safety Training Course,Certificate included I RoSPA approved member I CPD Certified I Audio visual training,https://www.reed.co.uk/courses/fire-safety-training-course/264320#/courses/discount?pageno=2&sortby=MostPopular,Training Express Ltd,40,40 students purchased this course,10.0,35.0,yes,The CPD Certification Service,no,no
228881,Global Project Management,"Project Management, Global Project Management that is Accredited Level 7 Diploma in Global Project Management",https://www.reed.co.uk/courses/global-project-management/228881#/courses/discount?pageno=2&sortby=MostPopular,UK Professional Development Academy LTD,55,55 students purchased this course,10.0,1050.0,yes,Step Ahead CPD,no,no
192726,Supervisor Training,Supervisor Training Level 3 | Endorsed by ABC Awards | Tutor Support and Assessments included in Course Price,https://www.reed.co.uk/courses/supervisor-training/192726#/courses/discount?pageno=2&sortby=MostPopular,Staff Training Solutions,298,298 students purchased this course,10.0,395.0,no,ABC Awards,yes,no
204136,Supply Chain Management - Course,Supply Chain Management (Level 7) Endorsed Certificate | 210 CPD Points | CPD Accredited Certificate,https://www.reed.co.uk/courses/supply-chain-management-course/204136#/courses/discount?pageno=2&sortby=MostPopular,CPD Courses,112,112 students purchased this course,15.0,1050.0,yes,ABC Awards,yes,no
267141,Designated Safeguarding Lead (DSL) - CPD Accredited,CPD Certified Designated Safeguarding Lead (DSL) I Free e-certificate I Instant Access I Unlimited 24/7 Access,https://www.reed.co.uk/courses/designated-safeguarding-lead-dsl-cpd-accredited/267141#/courses/discount?pageno=2&sortby=MostPopular,One Education,51,51 students purchased this course,15.0,199.0,yes,CPD Accreditation Group,no,no
77054,Forensic Science - CPD Certified,Accredited Online Course | Recognised Certificate Included | 24/7 Lifetime Access | Special Offer,https://www.reed.co.uk/courses/forensic-science-cpd-certified/77054#/courses/discount?pageno=2&sortby=MostPopular,International Open Academy,466,466 students purchased this course,10.0,119.0,yes,The CPD Certification Service,no,no
241743,Data Analysis In Excel -  CPD Accredited,Exam Included . CPD Accredited Qualification . Lifetime access . Immediate Result,https://www.reed.co.uk/courses/data-analysis-in-excel-cpd-accredited/241743#/courses/discount?pageno=2&sortby=MostPopular,Course Gate,320,320 students purchased this course,10.0,175.0,yes,The CPD Accreditation Group,no,no
81248,Food Safety Level 2 -  Local Authority Approved,ROSPA Accredited and Institute of Hospitality Endorsed,https://www.reed.co.uk/courses/food-safety-level-2-local-authority-approved/81248#/courses/discount?pageno=2&sortby=MostPopular,The Training Terminal,674,674 students purchased this course,12.0,30.0,yes,The Institute of Hospitality,no,no
250897,Diploma in Counselling Skills - Level 2,Accredited by ABC Awards | Assessment included in the Price | Endorsed Certificate & Unit Summery,https://www.reed.co.uk/courses/diploma-in-counselling-skills-level-2/250897#/courses/discount?pageno=2&sortby=MostPopular,South London College,103,103 students purchased this course,39.0,299.0,no,ABC Awards,yes,no
251941,British Sign Language Course Bundle,Summary,https://www.reed.co.uk/courses/british-sign-language-course-bundle/251941#/courses/discount?pageno=2&sortby=MostPopular,Study365,200,200 students purchased this course,19.0,289.0,yes,The CPD Certification Service,no,no
197995,Interior Design Course,Interior Design Level 3 | Endorsed by ABC Awards | CPD Accredited Certificate | 50 CPD Points,https://www.reed.co.uk/courses/interior-design-course/197995#/courses/discount?pageno=2&sortby=MostPopular,CPD Courses,166,166 students purchased this course,10.0,395.0,yes,ABC Awards,yes,no
222786,Teaching Assistants Training,Teaching Assistants Training - CPD Accredited ,https://www.reed.co.uk/courses/teaching-assistants-training/222786#/courses/discount?pageno=2&sortby=MostPopular,Study365,216,216 students purchased this course,29.0,199.0,yes,The CPD Certification Service,no,no
233614,Estate Agent Diploma ,Level 5 Endorsed Diploma by TQUK | 15 CPD Points I MCQ Based Assessment | Full Tutor Support | Instant Result,https://www.reed.co.uk/courses/estate-agent-diploma/233614#/courses/discount?pageno=2&sortby=MostPopular,One Education,646,646 students purchased this course,18.0,199.0,yes,Training Qualifications UK Ltd,yes,no
236572,"English: Spelling, Punctuation and Grammar - CPD Accredited","CPD Accredited English: Spelling, Punctuation and Grammar Course | Full Tutor Support | Instant Result | No hidden fees",https://www.reed.co.uk/courses/english-spelling-punctuation-and-grammar-cpd-accredited/236572#/courses/discount?pageno=2&sortby=MostPopular,One Education,379,379 students purchased this course,10.0,199.0,yes,CPD Accreditation Group,no,no
237490,Paediatric First Aid,Child Care Course,https://www.reed.co.uk/courses/paediatric-first-aid/237490#/courses/discount?pageno=2&sortby=MostPopular,Learning Connect,346,346 students purchased this course,10.0,45.0,yes,The CPD Standards Office,no,no
227141,Transport Manager Course,Transport Management Level 4 | Endorsed by ABC Awards | Tutor Support and Assessments included in the Course Price,https://www.reed.co.uk/courses/transport-manager-course/227141#/courses/discount?pageno=2&sortby=MostPopular,Staff Training Solutions,315,315 students purchased this course,10.0,560.0,no,ABC Awards,yes,no
238049,Compliance and Risk Management Course,Level 5 Endorsed Diploma by TQUK | 10 CPD Points I MCQ Based Assessment | Full Tutor Support | Instant Result,https://www.reed.co.uk/courses/compliance-and-risk-management-course/238049#/courses/discount?pageno=2&sortby=MostPopular,One Education,385,385 students purchased this course,18.0,199.0,yes,Training Qualifications UK Ltd,yes,no
55502,British Cleaning Certificate Course  – CPD Certified  – Only £49,Student Discount Card Eligible | Lifetime Access | Online certified training |Online certificate and exam included,https://www.reed.co.uk/courses/british-cleaning-certificate-course--cpd-certified--only-49/55502#/courses/discount?pageno=2&sortby=MostPopular,Be-a.co.uk,1596,"1,596 students purchased this course",49.0,299.0,yes,The CPD Certification Service,no,no
77004,Bartender and Barista Training - CPD Certified ,Accredited Online Course | Certificate Included | Lifetime Access |Discount Courses,https://www.reed.co.uk/courses/bartender-and-barista-training-cpd-certified/77004#/courses/discount?pageno=2&sortby=MostPopular,Eventtrix,343,343 students purchased this course,12.0,119.0,yes,The CPD Certification Service,no,no
259291,Teaching Assistant Diploma Level 5,ABC Awards Endorsed Professional Certificate . Level 5 . MCQ Assessment . Tutor Support,https://www.reed.co.uk/courses/teaching-assistant-diploma-level-5/259291#/courses/discount?pageno=2&sortby=MostPopular,Course Gate,74,74 students purchased this course,10.0,300.0,no,ABC Awards,yes,no
216730,"Introduction To Coding With HTML, CSS, & Javascript",Accredited Online Course | Recognised Certificate Included | Unlimited 24/7 Lifetime Access| New course!,https://www.reed.co.uk/courses/introduction-to-coding-with-html-css-javascript/216730#/courses/discount?pageno=2&sortby=MostPopular,International Open Academy,188,188 students purchased this course,12.0,119.0,no,missing,no,no
267093,Corporate Security Guard - CPD Accredited ,CPD Accredited Corporate Security Guard Course | Full Tutor Support | Instant Result | No hidden fees,https://www.reed.co.uk/courses/corporate-security-guard-cpd-accredited/267093#/courses/discount?pageno=2&sortby=MostPopular,One Education,28,28 students purchased this course,15.0,199.0,yes,CPD Accreditation Group,no,no
226257,Diploma in Dog Grooming ,Free E - Certificate Included | CPD & IAP Accredited | Access for 365 days | No Hidden Fee,https://www.reed.co.uk/courses/diploma-in-dog-grooming/226257#/courses/discount?pageno=2&sortby=MostPopular,Global Edulink,223,223 students purchased this course,18.0,249.0,yes,The CPD Certification Service,no,no
97410,Accounting Diploma,Accounting Diploma Level 4 Endorsed by ABC Awards with Study materials tutor support ,https://www.reed.co.uk/courses/accounting-diploma/97410#/courses/discount?pageno=2&sortby=MostPopular,Brentwood Open learning College,111,111 students purchased this course,25.0,560.0,no,ABC Awards,yes,no
173941,Microsoft Office,MS Office 2016 Advanced | Instant Access to Course Videos,https://www.reed.co.uk/courses/microsoft-office/173941#/courses/discount?pageno=2&sortby=MostPopular,Study365,611,611 students purchased this course,29.0,499.0,yes,The CPD Certification Service,no,no
260253,Proofreading & Editing Course Level 5 Diploma + Microsoft Word For Beginners,Get 2 Certification in 1 Course. Professional Certificate Endorsed by ABC Awards + CPD Certificate. Tutor Support,https://www.reed.co.uk/courses/proofreading-editing-course-level-5-diploma--microsoft-word-for-beginners/260253#/courses/discount?pageno=2&sortby=MostPopular,Course Gate,131,131 students purchased this course,17.0,300.0,yes,ABC Awards,yes,no
268588,Transport Manager,Transport Manager Level 4 | Endorsed by ABC Awards | CPD Accredited Certificate |80 CPD Points/Credits,https://www.reed.co.uk/courses/transport-manager/268588#/courses/discount?pageno=2&sortby=MostPopular,CPD Courses,7,7 students purchased this course,10.0,560.0,yes,ABC Awards,yes,no
234906,Dog Training Diploma,Gain Dog Training skills with this CPD Accredited Course | Tutor Support | Instant Result | No hidden fees,https://www.reed.co.uk/courses/dog-training-diploma/234906#/courses/discount?pageno=2&sortby=MostPopular,One Education,167,167 students purchased this course,14.0,199.0,no,missing,no,no
21770,Proofreading & copy editing course (Level 4 Diploma),Unlimited personal tutor support | Endorsed ABC Awards certificate | Fully accredited | Help finding proofreading work,https://www.reed.co.uk/courses/proofreading-copy-editing-course-level-4-diploma/21770#/courses/discount?pageno=2&sortby=MostPopular,College of Media and Publishing,4,"1,570 students enquired about this course",296.7,494.5,yes,ABC Awards,yes,no
82334,PRINCE2® Foundation & Practitioner, PRINCE2® Foundation & Practitioner + Official Exams|Awarded by PEOPLECERT ,https://www.reed.co.uk/courses/prince2-foundation-practitioner/82334#/courses/discount?pageno=2&sortby=MostPopular,Study365,158,158 students enquired about this course,469.0,749.0,no,PEOPLECERT),yes,no
102808,Building your Own Computer Course - CPD Certified ,Accredited Online Course | Recognised Certificate Included | Unlimited 24/7 Lifetime Access,https://www.reed.co.uk/courses/building-your-own-computer-course-cpd-certified/102808#/courses/discount?pageno=2&sortby=MostPopular,International Open Academy,194,194 students purchased this course,10.0,119.0,yes,The CPD Certification Service,no,no
250769,Lash Tint – Brow Tint Online Training - CPD Accredited,Gain Lash Tint – Brow Tinting skills with this CPD Accredited Course | Tutor Support | Instant Result | No hidden fees,https://www.reed.co.uk/courses/lash-tint--brow-tint-online-training-cpd-accredited/250769#/courses/discount?pageno=2&sortby=MostPopular,One Education,94,94 students purchased this course,10.0,199.0,yes,CPD Accreditation Group,no,no
266095,Online Phlebotomy Certificate ,CPD Accredited Online Certificate  II Introduction to Phlebotomy II Leads to Our Level 3 Certificate in Phlebotomy,https://www.reed.co.uk/courses/online-phlebotomy-certificate/266095#/courses/discount?pageno=2&sortby=MostPopular,Inspire London College Ltd,68,68 students purchased this course,10.0,150.0,yes,Step Ahead CPD Qualifications,no,no
228306,Estate Agent and Property Developer Diploma - CPD Certified,CPD Approved Training II Instant Access II Flexible Study II Free e-certificate included,https://www.reed.co.uk/courses/estate-agent-and-property-developer-diploma-cpd-certified/228306#/courses/discount?pageno=2&sortby=MostPopular,Janets,387,387 students purchased this course,14.0,325.0,yes,The CPD Group,no,no
238800,Nail Technician Diploma - CPD Certified,Exam Included . CPD Accredited Qualification . Lifetime access . Immediate Result,https://www.reed.co.uk/courses/nail-technician-diploma-cpd-certified/238800#/courses/discount?pageno=2&sortby=MostPopular,Course Gate,195,195 students purchased this course,12.0,175.0,yes,CPD Accreditation Group,no,no
96915,Physiotherapy Course,Summary,https://www.reed.co.uk/courses/physiotherapy-course/96915#/courses/discount?pageno=2&sortby=MostPopular,Oplex Careers,1027,"1,027 students purchased this course",19.0,299.99,yes,The CPD Certification Service,no,no
214451,Health and Safety,Health and Safety (Level 5) Endorsed by ABC Awards | 90 CPD Points | CPD Accredited Certificate,https://www.reed.co.uk/courses/health-and-safety/214451#/courses/discount?pageno=2&sortby=MostPopular,CPD Courses,85,85 students purchased this course,10.0,660.0,yes,ABC Awards,yes,no
233796,Anti-Money Laundering (AML) Training Course Level 3,Level 3 Endorsed Diploma by TQUK | 5 CPD Points I MCQ Based Assessment | Full Tutor Support | Instant Result,https://www.reed.co.uk/courses/anti-money-laundering-aml-training-course-level-3/233796#/courses/discount?pageno=2&sortby=MostPopular,One Education,426,426 students purchased this course,14.0,199.0,yes,Training Qualifications UK Ltd,yes,no
240477,Property Law Level 2 - CPD Accredited,Exam Included . CPD Accredited Qualification . Lifetime access . Immediate Result,https://www.reed.co.uk/courses/property-law-level-2-cpd-accredited/240477#/courses/discount?pageno=2&sortby=MostPopular,Course Gate,314,314 students purchased this course,10.0,175.0,yes,CPD Accreditation Group,no,no
162306,CBT - Cognitive Behavioural Therapy Course,Summary,https://www.reed.co.uk/courses/cbt-cognitive-behavioural-therapy-course/162306#/courses/discount?pageno=3&sortby=MostPopular,Renaissance Life Therapies of Harley Street London,275,275 students purchased this course,10.0,200.0,yes,The CPD Standards Office,no,no
176031,PRINCE2® Foundation course including Exam with Free Re-Sit,PRINCE2® Foundation course including Exam + Free Re-Sit,https://www.reed.co.uk/courses/prince2-foundation-course-including-exam-with-free-re-sit/176031#/courses/discount?pageno=3&sortby=MostPopular,Study365,1089,"1,089 students enquired about this course",279.0,499.0,no,PEOPLECERT),yes,no
247486,"Microsoft Excel Complete Course - Beginner, Intermediate & Advanced TQUK Endorsed","Microsoft Excel Complete Course - Beginner, Intermediate & Advanced- CPD Accredited ",https://www.reed.co.uk/courses/microsoft-excel-complete-course-beginner-intermediate-advanced-tquk-endorsed/247486#/courses/discount?pageno=3&sortby=MostPopular,Inspire London College Ltd,35,35 students purchased this course,10.0,595.0,no,Training Qualifications UK Ltd,yes,no
250380,First Aid at Work - CPD Accredited,Gain First Aid at Workplace's skills with this CPD Accredited course | Tutor support | Instant result | No hidden fees,https://www.reed.co.uk/courses/first-aid-at-work-cpd-accredited/250380#/courses/discount?pageno=3&sortby=MostPopular,One Education,121,121 students purchased this course,10.0,199.0,yes,CPD Accreditation Group,no,no
192990,Safeguarding Vulnerable Adults - Level 1 - Online Course - CPD Accredited,Instant Access | Includes Assessment & Certificate | UK CPD Accredited | Instant Certificate Download,https://www.reed.co.uk/courses/safeguarding-vulnerable-adults-level-1-online-course-cpd-accredited/192990#/courses/discount?pageno=3&sortby=MostPopular,Mandatory Training Group,153,153 students purchased this course,12.75,14.99,yes,The CPD Certification Service,no,no
259203,Payroll Administrator Training - CPD Accredited,Exam & Tutor Support Included With The Course Price | Instant Result |  | No Hidden Fees | 12 Months Access,https://www.reed.co.uk/courses/payroll-administrator-training-cpd-accredited/259203#/courses/discount?pageno=3&sortby=MostPopular,One Education,184,184 students purchased this course,15.0,199.0,yes,CPD Accreditation Group,no,no
221603,Health and Social Care Course,The Stepping Stone to a Rewarding Career!,https://www.reed.co.uk/courses/health-and-social-care-course/221603#/courses/discount?pageno=3&sortby=MostPopular,e-Careers.Lifestyle,28,28 students purchased this course,24.0,200.0,no,missing,no,no
224579,Digital Marketing Diploma,Advanced Digital Marketing Level 4 Diploma from Training Qualifications UK II Online Tutor Support Included ,https://www.reed.co.uk/courses/digital-marketing-diploma/224579#/courses/discount?pageno=3&sortby=MostPopular,Inspire London College Ltd,180,180 students purchased this course,10.0,595.0,no,Training Qualifications UK Ltd,yes,no
267986,CAD Designer Training - CPD Accredited,CPD Accredited Cad Designer Training Course| Full Tutor Support | Instant Result | No hidden fees,https://www.reed.co.uk/courses/cad-designer-training-cpd-accredited/267986#/courses/discount?pageno=3&sortby=MostPopular,One Education,32,32 students purchased this course,17.0,199.0,yes,CPD Accreditation Group,no,no
227875,CIPD Level 5 Intermediate Certificate in HR Management | HR,Invest in yourself | Save up to 25% on Level 5 CIPD courses in March,https://www.reed.co.uk/courses/cipd-level-5-intermediate-certificate-in-hr-management--hr/227875#/courses/discount?pageno=3&sortby=MostPopular,ICS Learn,393,393 students enquired about this course,2400.0,2900.0,no,Chartered Institute of Personnel and Development,yes,no
230335,Youth Work Training Course - Level 3 CPD Accredited,Summary,https://www.reed.co.uk/courses/youth-work-training-course-level-3-cpd-accredited/230335#/courses/discount?pageno=3&sortby=MostPopular,Oplex Careers,274,274 students purchased this course,24.0,199.99,yes,The CPD Certification Service,no,no
97545,Diploma in Fashion Design Level 5,Fashion Design Level 5 endorsed certificate by ABC Awards with tutor support ,https://www.reed.co.uk/courses/diploma-in-fashion-design-level-5/97545#/courses/discount?pageno=3&sortby=MostPopular,Brentwood Open learning College,198,198 students purchased this course,10.0,760.0,no,ABC Awards,yes,no
245986,HR - Diploma,HR Management Level 4 Endorsed by ABC Awards I Tutor Support & Assessments included in the course price,https://www.reed.co.uk/courses/hr-diploma/245986#/courses/discount?pageno=3&sortby=MostPopular,Oxford Home Study College,134,134 students purchased this course,10.0,560.0,no,ABC Awards,yes,no
245041,Diet and Nutrition ,Diet and Nutrition Level 5 Advanced Diploma Endorsed by ABC Awards (Covers Nutritional needs for all age groups),https://www.reed.co.uk/courses/diet-and-nutrition/245041#/courses/discount?pageno=3&sortby=MostPopular,Oxford Home Study College,488,488 students purchased this course,10.0,740.0,no,ABC Awards,yes,no
